long_name,short_name,geolocation,is_goverment,rating,logo,website,phone_admission,phone_general,email_general,email_admission,army,comment
Институт пищевых технологий и дизайна (филиал) Нижегородского государственного инженерно-экономического университета,Институт пищевых технологий и дизайна НГИЭУ,Нижегородская область,1,-1,https://tabiturient.ru/logovuz/ngieu.png,https://iptdnn.ru/,[],['+7(831)282-30-66'],['iptd@iptdnn.ru'],[],False,
Институт сферы обслуживания и предпринимательства (филиал) Донского государственного технического университета в г. Шахты,Институт сферы обслуживания и предпринимательства ДГТУ в г. Шахты,Ростовская область,1,-1,https://tabiturient.ru/logovuz/donstu.png,https://www.sssu.ru/,['+7 (988) 946-54-85'],[],[],['mail@sssu.ru'],False,
Институт технологий (филиал) Донского государственного технического университета в г. Волгодонске,Институт технологий ДГТУ в г. Волгодонске,Ростовская область,1,-1,https://tabiturient.ru/logovuz/donstu.png,http://www.vis2.ru/,[],[],[],[],False,
Институт ядерной энергетики (филиал) Cанкт-Петербургского политехнического университета Петра Великого в г. Сосновый Бор,Институт ядерной энергетики СПбПУ в г. Сосновый Бор,Санкт-Петербург и Ленинградская область,1,-1,https://tabiturient.ru/logovuz/spbstu.png,https://sbor.spbstu.ru/,[],[],[],[],False,
Иркутский государственный университет путей сообщения,ИрГУПС,Иркутская область,1,3,https://tabiturient.ru/logovuz/irgups.png,https://www.irgups.ru/,['+7 (3952) 63-83-70'],[],[],['pk@irgups.ru'],True,
Иркутский государственный аграрный университет имени А. А. Ежевского,Иркутский ГАУ,Иркутская область,1,3,https://tabiturient.ru/logovuz/irsau.png,http://irsau.ru/,[],[],['antikorruptsia@igsha.ru'],[],False,
Иркутский институт (филиал) Всероссийского государственного университета юстиции (РПА Минюста России),Иркутский институт ВГУЮ,Иркутская область,1,-1,https://tabiturient.ru/logovuz/rpa.png,https://irk.rpa-mu.ru/,['+7 (4212) 94-00-26'],"['+7 (3852) 24-89-94', '+7 (812) 328-45-18', '+7 (843) 298-65-75', '+7 (4212) 94-00-26', '+7 (8142) 57-96-91', '+7 (4872) 70-02-24', '+7 (8452) 57-47-44', '+7 (8722) 51-57-33', '+7 (863) 201-84-23', '+7 (8342) 24-05-23', '+7 (343) 251-37-00', '+7 (3952) 24-30-49']",[],[],False,
Иркутский филиал филиал филиал Всероссийского государственного института кинематографии им. С.А. Герасимова,Иркутский филиал ВГИК,Иркутская область,1,-1,https://tabiturient.ru/logovuz/vgik.png,www.irkvgik.ru,[],[],[],[],False,
Иркутский филиал Московского государственного технического университета гражданской авиации,Иркутский филиал МГТУ ГА,Иркутская область,1,-1,https://tabiturient.ru/logovuz/mstuca.png,http://if-mstuca.ru,['8(3952) 54-38-39'],['8(3952) 54-38-39'],['do@if-mstuca.ru'],['do@if-mstuca.ru'],False,
Иркутский филиал Российского университета  спорта «ГЦОЛИФК»,Иркутский филиал РУС «ГЦОЛИФК»,Иркутская область,1,-1,https://tabiturient.ru/logovuz/rgufksmit.png,https://www.ifrgufk.ru/,[],[],[],[],False,
Ишимский педагогический институт им. П.П. Ершова (филиал) Тюменского государственного университета,Ишимский педагогический институт им. П.П. Ершова ТюмГУ,Тюменская область,1,-1,https://tabiturient.ru/logovuz/tumgu.png,https://ishim.utmn.ru/,[],[],[],[],False,
Курская академия государственной и муниципальной службы,КАГМС,Курская область,1,5,https://tabiturient.ru/logovuz/kagms.png,https://kagms.ru/,[],['+7 (4712) 34-32-68'],[],[],False,
Кабардино-Балкарский государственный университет имени Х. М. Бербекова,КБГУ им. Х. М. Бербекова,Кабардино-Балкарская Республика,1,6,https://tabiturient.ru/logovuz/kbsu.png,https://kbsu.ru/,[],[],[],[],False,
Казанская государственная академия ветеринарной медицины имени Н. Э. Баумана,КГАВМ им. Н.Э. Баумана,Республика Татарстан,1,5,https://tabiturient.ru/logovuz/kazanveterinary.png,https://kazanveterinary.ru/,['+7 (843) 598-44-04'],[],['study@kazanveterinary.ru'],[],False,
Казанский государственный архитектурно-строительный университет,КГАСУ,Республика Татарстан,1,7,https://tabiturient.ru/logovuz/kgasu.png,https://www.kgasu.ru/,['+7 (843) 510-46-01'],[],[],['info@kgasu.ru'],False,
Казанский государственный аграрный университет,КГАУ,Республика Татарстан,1,3,https://tabiturient.ru/logovuz/kazgau.png,https://www.kazgau.ru/,['8 (960) 056-76-67'],[],[],['info@kazgau.com'],False,
Казанская государственная консерватория имени Н.Г. Жиганова,КГК им. Н. Г. Жиганова,Республика Татарстан,1,-1,https://tabiturient.ru/logovuz/kazancons.png,https://new.kazancons.ru/,"['+7 (843) 236-55-33', '+7 (843) 236-59-62']",['+7 (843) 236-55-33'],['2365533@list.ru'],"['2365533@list.ru', 'priem@kazancons.ru']",False,
Керченский государственный морской технологический университет,КГМТУ,Республика Крым и Севастополь,1,3,https://tabiturient.ru/logovuz/kgmtu.png,http://www.kgmtu.ru/,['8 (800) 222-55-71'],['8 (800) 222-55-71'],[],[],False,
Казанский государственный медицинский университет,КГМУ,Республика Татарстан,1,9,https://tabiturient.ru/logovuz/kgmu.png,https://kazangmu.ru/,[],[],[],[],False,
Курский государственный медицинский университет,КГМУ,Курская область,1,9,https://tabiturient.ru/logovuz/kurskmed.png,https://kurskmed.com/,"['8(920)260-47-66', '84712588138']",[],['kurskmed@mail.ru'],['kurskmed@mail.ru'],False,
Кузбасский гуманитарно-педагогический институт (филиал) Кемеровского государственного университета,КГПИ КемГУ,Кемеровская область,1,-1,https://tabiturient.ru/logovuz/kemsu.png,https://xn--c1akev.xn--p1ai/,[],[],[],[],False,
Красноярский государственный педагогический университет им. В.П. Астафьева,КГПУ им. В.П. Астафьева,Красноярский край,1,7,https://tabiturient.ru/logovuz/kspu.png,http://www.kspu.ru/,[],[],[],['press@kspu.ru'],False,
Ковровская государственная технологическая академия имени В.А. Дегтярева,КГТА им. В.А. Дегтярева,Владимирская область,1,5,https://tabiturient.ru/logovuz/dksta.png,https://dksta.ru/,[],[],[],[],True,
Калининградский государственный технический университет,КГТУ,Калининградская область,1,5,https://tabiturient.ru/logovuz/klgtu.png,http://www.klgtu.ru,[],[],[],[],False,
Курский государственный университет,КГУ,Курская область,1,6,https://tabiturient.ru/logovuz/kursksu.png,https://kursksu.ru/,[],['8 (4712) 70-54-61'],[],[],False,
Костромской государственный университет,КГУ,Костромская область,1,5,https://tabiturient.ru/logovuz/ksuedu.png,https://ksu.edu.ru/,[],[],[],[],True,
Курганский государственный университет,КГУ,Курганская область,1,5,https://tabiturient.ru/logovuz/kgsu.png,http://kgsu.ru/,['+7 (3522) 65-30-30'],"['810345370000', '+7 (3522) 65-49-99']",[],[],True,
Калужский государственный университет им. К.Э. Циолковского,КГУ им. К.Э. Циолковского,Калужская область,1,7,https://tabiturient.ru/logovuz/tksu.png,https://tksu.ru/,[],[],[],[],False,
"Кубанский государственный университет физической культуры, спорта и туризма",КГУФКСТ,Краснодарский край,1,6,https://tabiturient.ru/logovuz/kgufkst.png,https://kgufkst.ru/,[],['+7 (861) 255-35-17'],['doc@kgufkst.ru'],[],False,
Казанский государственный энергетический университет,КГЭУ,Республика Татарстан,1,8,https://tabiturient.ru/logovuz/kgeu.png,https://kgeu.ru/,['+7 (843) 519-42-20'],[],[],[],False,
Курганский институт железнодорожного транспорта (филиал) Уральского государственного университета путей сообщения,КИЖТ УрГУПС,Курганская область,1,-1,https://tabiturient.ru/logovuz/usurt.png,https://kirt.usurt.ru/,[],[],[],[],False,
Крымский инженерно-педагогический университет имени Февзи Якубова,КИПУ им. Якубова,Республика Крым и Севастополь,1,3,https://tabiturient.ru/logovuz/kipu.png,http://kipu-rc.ru/,[],[],[],['cepu@crimeaedu.ru'],False,
Казанский национальный исследовательский технологический университет,КНИТУ,Республика Татарстан,1,6,https://tabiturient.ru/logovuz/knitu.png,https://www.kstu.ru/,[],[],[],[],True,
Казанский национальный исследовательский технический университет имени А. Н. Туполева,КНИТУ-КАИ,Республика Татарстан,1,8,https://tabiturient.ru/logovuz/kai.png,https://kai.ru/,[],['+7 (843) 231-01-09'],['kai@kai.ru'],[],False,
Коми республиканская академия государственной службы и управления,КРАГСиУ,Республика Коми,1,-1,https://tabiturient.ru/logovuz/krags.png,https://www.krags.ru/,['+7 (8212) 30-27-80'],[],[],['doc@krags.ru'],False,
"Крымский университет культуры, искусств и туризма",КУКИиТ,Республика Крым и Севастополь,1,-1,https://tabiturient.ru/logovuz/kukiit.png,http://kukiit.ru/,['8 (800)  200-01-22'],['8 (800)  200-01-22'],[],['kukiit@kukiit.ru'],False,
Корпоративный университет развития образования,КУРО,Москва и Московская область,1,-1,https://tabiturient.ru/logovuz/asou.png,https://kuro-mo.ru/,[],[],[],[],False,
Куйбышевский филиал Новосибирского государственного педагогического университета,КФ НГПУ,Новосибирская область,1,-1,https://tabiturient.ru/logovuz/nspu.png,https://kf.nspu.ru/,[],[],[],"['kf_ngpu@nspu.ru', '21-146@mail.ru']",False,
Казанский филиал Российского Государственного Университета Правосудия (г. Казань),КФ ФГБОУВО «РГУП»,Республика Татарстан,1,-1,https://tabiturient.ru/logovuz/raj.png,https://kb.rgup.ru,['+7 (843) 202-26-50'],[],[],[],True,
Казанский (Приволжский) Федеральный Университет,КФУ,Республика Татарстан,1,9,https://tabiturient.ru/logovuz/kfu.png,http://kpfu.ru/,[],[],[],['priem@kpfu.ru'],False,
Крымский федеральный университет имени В.И. Вернадского,КФУ им. Вернадского,Республика Крым и Севастополь,1,7,https://tabiturient.ru/logovuz/cfuv.png,https://cfuv.ru/,[],[],[],[],True,
Карачаево-Черкесский государственный университет имени У. Д. Алиева,КЧГУ им. У.Д. Алиева,Карачаево-Черкесская Республика,1,3,https://tabiturient.ru/logovuz/kchgu.png,https://kchgu.ru/,[],[],[],[],False,
Кабардино-Балкарский государственный аграрный университет имени В. М. Кокова,Кабардино-Балкарский ГАУ,Кабардино-Балкарская Республика,1,3,https://tabiturient.ru/logovuz/kbgau.png,https://kbgau.ru/,[],[],[],[],False,
Казанский государственный университет культуры и искусств,КазГИК,Республика Татарстан,1,-1,https://tabiturient.ru/logovuz/kazgik.png,https://kazgik.ru/,['8 843 277-58-36'],"['8(843) 277-58-36', '8 843 277-58-36']",[],[],False,
Казанский институт (филиал) Всероссийского государственного университета юстиции (РПА Минюста России),Казанский институт ВГУЮ,Республика Татарстан,1,-1,https://tabiturient.ru/logovuz/rpa.png,https://kzn.rpa-mu.ru/,['+79272495155'],"['+7 (3852) 24-89-94', '+7 (812) 328-45-18', '+7 (843) 298-65-75', '+7 (4212) 94-00-26', '+7 (8142) 57-96-91', '+7 (4872) 70-02-24', '+7 (8452) 57-47-44', '+7 (8722) 51-57-33', '+7 (8342) 24-05-23', '+79272495155', '+7 (863) 308-95-24', '+7 (343) 251-37-00', '+7 (3952) 24-30-49']",['priem@kznrpa.ru'],['priem@kznrpa.ru'],True,
Казанский филиал Российской академии народного хозяйства и государственной службы при Президенте Российской Федерации,Казанский филиал РАНХиГС,Республика Татарстан,1,-1,https://tabiturient.ru/logovuz/kaz_ranepa.png,https://kaz.ranepa.ru/,[],[],[],[],False,
Калмыцкий государственный университет,КалмГУ,Республика Калмыкия,1,3,https://tabiturient.ru/logovuz/kalmgu.png,https://www.kalmgu.ru/,[],[],['uni@kalmsu.ru'],[],False,
Калужский институт (филиал) Всероссийского государственного университета юстиции (РПА Минюста России),Калужский институт ВГУЮ,Калужская область,1,-1,https://tabiturient.ru/logovuz/rpa.png,https://kaluga.rpa-mu.ru/,[],[],[],[],False,
Калужский филиал Московского государственного технического университета имени Н.Э. Баумана,Калужский филиал МГТУ им. Баумана,Калужская область,1,-1,https://tabiturient.ru/logovuz/mgtu.png,https://kf.bmstu.ru/,['+7 (800) 234-48-42'],[],[],['bauman.kf@bmstu.ru'],False,
Калужский филиал Российской академии народного хозяйства и государственной службы при Президенте Российской Федерации,Калужский филиал РАНХиГС,Калужская область,1,-1,https://tabiturient.ru/logovuz/klg_ranepa.png,https://klg.ranepa.ru/,[],[],[],[],False,
Калужский филиал Финансового Университета при Правительстве Российской Федерации,Калужский филиал ФУ при Правительстве РФ,Калужская область,1,-1,https://tabiturient.ru/logovuz/fu.png,http://www.fa.ru/fil/kaluga/,[],[],[],[],False,
Камчатский государственный университет имени Витуса Беринга,КамГУ им. Витуса Беринга,Камчатский край,1,6,https://tabiturient.ru/logovuz/kamgu.png,http://www.kamgu.ru/,[],[],[],[],False,
Камчатский государственный технический университет,КамчатГТУ,Камчатский край,1,3,https://tabiturient.ru/logovuz/kamchatgtu.png,http://kamchatgtu.ru/,[],[],[],[],True,
Камышинский технологический институт (филиал) Волгоградского государственного технического университета,Камышинский технологический институт (филиал) ВолгГТУ,Волгоградская область,1,-1,https://tabiturient.ru/logovuz/vstu.png,https://www.kti.ru/,[],[],['webmaster@kti.ru'],[],False,
Карельский филиал Российской академии народного хозяйства и государственной службы при Президенте Российской Федерации,Карельский филиал РАНХиГС,Республика Карелия,1,-1,https://tabiturient.ru/logovuz/krl_ranepa.png,https://krl.ranepa.ru/,[],[],[],[],False,
Каспийский институт морского и речного транспорта имени генерал-адмирала Ф.М. Апраксина - филиал Волжского государственного университета водного транспорта,Каспийский институт морского и речного транспорта  им. ген.-адм. Ф.М. Апраксина ВГУВТ,Астраханская область,1,-1,https://tabiturient.ru/logovuz/vsuwt.png,https://www.afvgavt.ru/,[],['8(8512)44-27-71'],[],[],False,
Кемеровский государственный институт культуры,КемГИК,Кемеровская область,1,-1,https://tabiturient.ru/logovuz/kemguki.png,http://www.kemguki.ru/,"['8 (3842) 73-28-56', '8 (3842) 73-28-08']",[],[],"['priemnaya@kemguki.ru', 'abitur@kemguki.ru']",False,
Кемеровский государственный медицинский университет,КемГМУ,Кемеровская область,1,6,https://tabiturient.ru/logovuz/kemsmu.png,https://kemsmu.ru/,"['8 (3842) 73-48-56', '+7 (905) 912-43-62']",[],[],"['abit@kemsma.ru', 'kemsma@kemsma.ru']",False,
Кемеровский государственный университет,КемГУ,Кемеровская область,1,5,https://tabiturient.ru/logovuz/kemsu.png,https://kemsu.ru/,"['+7 (3842) 58-38-85', '+7 (3842) 58-39-12']",['8 (800) 222-55-71'],['webkemsu@mail.ru'],['priem@kemsu.ru'],False,
Керченский филиал Крымского инженерно-педагогического университета имени Февзи Якубова,Керченский филиал КИПУ им. Якубова,Республика Крым и Севастополь,1,-1,https://tabiturient.ru/logovuz/kipu.png,https://kerch.kipu-rc.ru/,['+7 (978) 024-72-32'],['+7 (978) 024-72-32'],['ykp_kerch@mail.ru'],['ykp_kerch@mail.ru'],False,
Кировский государственный медицинский университет,Кировский ГМУ,Кировская область,1,7,https://tabiturient.ru/logovuz/kirovgma.png,https://www.kirovgma.ru/,[],['8\xa0(8332)\xa064-09-76'],['med@kirovgma.ru'],[],False,
Кировский филиал Российской академии народного хозяйства и государственной службы при Президенте Российской Федерации,Кировский филиал РАНХиГС,Кировская область,1,-1,https://tabiturient.ru/logovuz/krv_ranepa.png,https://krv.ranepa.ru/,[],[],[],[],False,
Комсомольский-на-Амуре государственный университет,КнАГУ,Хабаровский край,1,3,https://tabiturient.ru/logovuz/knastu.png,https://knastu.ru/,['8 (800) 222-55-71'],['8 (800) 222-55-71'],[],[],True,
Нижегородский государственный инженерно-экономический университет,Княгининский университет,Нижегородская область,1,3,https://tabiturient.ru/logovuz/ngieu.png,http://ngieu.ru/,[],[],[],[],False,
Коломенский институт (филиал) Московского политехнического университета,Коломенский институт Московского политеха,Москва и Московская область,1,-1,https://tabiturient.ru/logovuz/mospolytech.png,https://polytech-kolomna.ru/,"['+7(496)615-16-47', '8 496 615-16-47']",['+7(496)615-16-47'],[],['polytech-kolomna@mail.ru'],False,
Костромская государственная сельскохозяйственная академия,Костромская ГСХА,Костромская область,1,3,https://tabiturient.ru/logovuz/kgsxa.png,https://kgsxa.ru/,[],[],[],[],True,
Крымский филиал Российского Государственного Университета Правосудия,КрФ ФГБОУВО «РГУП»,Республика Крым и Севастополь,1,-1,https://tabiturient.ru/logovuz/raj.png,https://crb.rgup.ru/,['+7 (3652) 66-84-41'],[],[],[],False,
Красноярский государственный аграрный университет,КрасГАУ,Красноярский край,1,5,https://tabiturient.ru/logovuz/krasgau.png,http://www.kgau.ru/,[],[],[],[],False,
Красноярский государственный медицинский университет,КрасГМУ,Красноярский край,1,9,https://tabiturient.ru/logovuz/krasgmu.png,https://krasgmu.ru/,[],[],[],[],False,
Краснодарский филиал Российского экономического университета имени Г.В. Плеханова,Краснодарский филиал РЭУ им. Плеханова,Краснодарский край,1,-1,https://tabiturient.ru/logovuz/reu.png,https://krasnodar.rea.ru/,['+7 (495) 958-27-43'],['8 (800) 222-55-71'],[],['rector@rea.ru'],False,
Краснодарский филиал Финансового Университета при Правительстве Российской Федерации,Краснодарский филиал ФУ при Правительстве РФ,Краснодарский край,1,-1,https://tabiturient.ru/logovuz/fu.png,http://www.fa.ru/fil/krasnodar/,[],[],[],[],False,
Красноярский институт железнодорожного транспорта (филиал) Иркутского государственного университета путей сообщения,Красноярский институт железнодорожного транспорта ИрГУПС,Красноярский край,1,-1,https://tabiturient.ru/logovuz/irgups.png,https://www.irgups.ru/krizht/,['+7 (3952) 63-83-70'],[],[],['pk@irgups.ru'],False,
Кубанский государственный аграрный университет имени И.Т. Трубилина,КубГАУ,Краснодарский край,1,7,https://tabiturient.ru/logovuz/kubsau.png,https://kubsau.ru/,[],[],[],[],True,
Кубанский государственный медицинский университет,КубГМУ,Краснодарский край,1,9,https://tabiturient.ru/logovuz/ksma.png,http://www.ksma.ru/,['+7 (800) 444-19-20'],[],['corpus@ksma.ru'],['corpus@ksma.ru'],False,
Кубанский государственный технологический университет,КубГТУ,Краснодарский край,1,6,https://tabiturient.ru/logovuz/kubstu.png,https://kubstu.ru/,[],[],[],[],False,
Кубанский государственный университет,КубГУ,Краснодарский край,1,8,https://tabiturient.ru/logovuz/kubsu.png,https://kubsu.ru/ru,['+7 (861) 219-95-30'],[],[],['abitur@kubsu.ru'],False,
