long_name,short_name,geolocation,is_goverment,rating,logo,website,phone_admission,phone_general,email_general,email_admission,army,comment
Новосибирский государственный педагогический университет,НГПУ,Новосибирская область,1,7,https://tabiturient.ru/logovuz/nspu.png,https://www.nspu.ru/,['8\n                                    \n\n\n\n\n\n\n\n\n\n\n(383) 244-11-61'],[],['press@nspu.ru'],"['press@nspu.ru', 'nspu@nspu.ru']",False,
Набережночелнинский государственный педагогический университет,НГПУ,Республика Татарстан,1,5,https://tabiturient.ru/logovuz/tatngpi.png,https://tatngpi.ru/,"['+7(8552) 46-62-16', '+7(8552) 46-97-74']",[],[],['ngpi@tatngpi.ru'],False,
Нижегородский государственный педагогический университет им. К. Минина,НГПУ им. К. Минина,Нижегородская область,1,8,https://tabiturient.ru/logovuz/ngpu_minin.png,https://mininuniver.ru/,['+7 (831) 262-26-20'],[],[],[],False,
Новосибирский государственный технический университет,НГТУ НЭТИ,Новосибирская область,1,7,https://tabiturient.ru/logovuz/nstu.png,https://www.nstu.ru/,[],[],[],['pk@nstu.ru'],False,
Нижегородский государственный технический университет имени Р.Е. Алексеева,НГТУ им. Р.Е. Алексеева,Нижегородская область,1,7,https://tabiturient.ru/logovuz/nntu.png,https://www.nntu.ru/,[],[],[],['nntu@nntu.ru'],False,
Новосибирский Государственный Университет,НГУ,Новосибирская область,1,9,https://tabiturient.ru/logovuz/nsu.png,http://www.nsu.ru/,[],[],[],[],False,
"Национальный государственный университет физической культуры, спорта и здоровья имени П. Ф. Лесгафта",НГУ им. П. Ф. Лесгафта,Санкт-Петербург и Ленинградская область,1,5,https://tabiturient.ru/logovuz/lesgaft.png,http://lesgaft.spb.ru/,[],[],[],[],False,
"Новосибирский государственный университет архитектуры, дизайна и искусств имени А.Д. Крячкова",НГУАДИ,Новосибирская область,1,9,https://tabiturient.ru/logovuz/nsuada.png,http://nsuada.ru/,"['+7 (383)\xa0209-17-50', '+7 (383) 222-10-00']","['+7 (383) 286-97-71', '+7 (383) 222-10-00']",[],[],False,
Новосибирский государственный университет экономики и управления,НГУЭУ,Новосибирская область,1,7,https://tabiturient.ru/logovuz/nsuem.png,https://nsuem.ru/,[],[],[],['priemc@nsuem.ru'],False,
Национальный Исследовательский Университет Высшая Школа Экономики,НИУ ВШЭ,Москва и Московская область,1,10,https://tabiturient.ru/logovuz/hse.png,https://www.hse.ru/,[],[],[],[],False,
Высшая школа экономики в Нижнем Новгороде,НИУ ВШЭ НН,Нижегородская область,1,10,https://tabiturient.ru/logovuz/hse-nn.png,https://nnov.hse.ru/,['+7 831 436-74-09'],[],[],['pknn@hse.ru'],False,
Высшая школа экономики в Перми,НИУ ВШЭ Пермь,Пермский край,1,9,https://tabiturient.ru/logovuz/hseperm.png,https://perm.hse.ru/,"[""8 (342) 200-96-96""]","[""infoperm@hse.ru""]","['infoperm@hse.ru', 'PR-perm@hse.ru', 'abitur.perm@hse.ru', 'sdoperm@hse.ru', 'fdpperm@hse.ru', 'lycperm@hse.ru']","[""abitur.perm@hse.ru""]",False,
Высшая школа экономики в Санкт-Петербурге,НИУ ВШЭ СПБ,Санкт-Петербург и Ленинградская область,1,10,https://tabiturient.ru/logovuz/hse-spb.png,https://spb.hse.ru/,"['+7 (812) 644-62-12', '+7 (812) 644-59-11']",['+7(929)677-63-06'],['press-spb@hse.ru'],"['abitur-spb@hse.ru', 'office-spb@hse.ru']",False,
Национальный исследовательский Московский государственный строительный университет,НИУ МГСУ,Москва и Московская область,1,8,https://tabiturient.ru/logovuz/mgsu.png,http://mgsu.ru/,['+7 (495) 781-99-88'],['+7 (495) 781-99-88'],['kanz@mgsu.ru'],['data-25@mail.ru'],True,
"Национальный исследовательский университет ""Московский энергетический институт""",НИУ МЭИ,Москва и Московская область,1,9,https://tabiturient.ru/logovuz/mpei.png,http://mpei.ru/,"['+7 495 362-75-60', '+7 495 362-77-77']",['+7 495 362-75-06'],"['pressa@mpei.ru', 'universe@mpei.ac.ru']","['universe@mpei.ac.ru', '362-77-77pk@mpei.ru']",False,
Нижегородский институт управления - филиал РАНХиГС,НИУ РАНХиГС,Нижегородская область,1,8,https://tabiturient.ru/logovuz/niuranepa.png,https://niu.ranepa.ru/,[],[],[],[],False,
Национальный исследовательский ядерный университет (Московский инженерно-физический институт),НИЯУ МИФИ,Москва и Московская область,1,10,https://tabiturient.ru/logovuz/mifi.png,https://mephi.ru/,['+7\xa0800\xa0775\xa01551'],[],['info@mephi.ru'],['info@mephi.ru'],False,
Национальный медицинский исследовательский центр имени В. А. Алмазова,НМИЦ им. В. А. Алмазова,Санкт-Петербург и Ленинградская область,1,10,https://tabiturient.ru/logovuz/almazovcentre.png,http://www.almazovcentre.ru/,[],[],[],[],False,
Нижегородский государственный архитектурно-строительный университет,ННГАСУ,Нижегородская область,1,5,https://tabiturient.ru/logovuz/nngasu.png,http://www.nngasu.ru/,[],[],[],[],False,
Нижегородский государственный университет имени Н. И. Лобачевского,ННГУ им. Лобачевского,Нижегородская область,1,9,https://tabiturient.ru/logovuz/unn.png,http://www.unn.ru/,['8 800 222-55-71'],[],[],"['unn@unn.ru', 'mfc@unn.ru']",False,
Нижнетагильский государственный социально-педагогический институт (филиал) РГППУ в г. Нижнем Тагиле,НТГСПИ (филиал) РГППУ в г. Нижнем Тагиле,Свердловская область,1,-1,https://tabiturient.ru/logovuz/rsvpu.png,https://ntspi.ru/,[],[],['office@ntspi.ru'],[],False,
Невинномысский технологический институт (филиал) Северо-Кавказского федерального университета,НТИ (филиал) СКФУ,Ставропольский край,1,-1,https://tabiturient.ru/logovuz/ncfu.png,https://nti.ncfu.ru/,['8 (928) 230-80-44'],[],['nv.info@ncfu.ru'],['nv.info@ncfu.ru'],False,
Новоуральский технологический институт  (филиал) Национального исследовательского ядерного университета МИФИ,НТИ НИЯУ МИФИ,Свердловская область,1,-1,https://tabiturient.ru/logovuz/ntimephi.png,https://nti.mephi.ru/,[],[],['nsti@mephi.ru'],[],False,
Набережночелнинский филиал Казанского национального исследовательского технического университета имени А. Н. Туполева,НЧФ КНИТУ-КАИ,Республика Татарстан,1,-1,https://tabiturient.ru/logovuz/kai.png,https://chelny.kai.ru,[],['+7 (843) 231-01-09'],['kai@kai.ru'],[],False,
Набережночелнинский институт Казанского федерального университета,Набережночелнинский институт КФУ,Республика Татарстан,1,-1,https://tabiturient.ru/logovuz/kfu.png,https://kpfu.ru/chelny,[],['8552) 39-71-40'],['chelny@kpfu.ru'],[],False,
Нижегородский государственный агротехнологический университет,Нижегородский ГАТУ,Нижегородская область,1,3,https://tabiturient.ru/logovuz/nnsaa.png,https://nnsatu.ru/,"['+7 (930) 705-60-89', '+7 (831) 214-33-49']",['+7 (831) 214-33-49'],['kancel-nnsatu@bk.ru'],['kancel-nnsatu@bk.ru'],False,
Нижегородский институт управления - филиал Российской академии народного хозяйства и государственной службы при Президенте Российской Федерации,Нижегородский институт управления - филиал РАНХиГС,Нижегородская область,1,-1,https://tabiturient.ru/logovuz/niu_ranepa.png,https://niu.ranepa.ru/,[],[],[],[],False,
Нижнекамский химико-технологический институт (филиал) Казанского национального исследовательского технологического университета,Нижнекамский химико-технологический институт КНИТУ,Республика Татарстан,1,-1,https://tabiturient.ru/logovuz/knitu.png,https://www.nchti.ru/,[],['8(8555) 44-88-49'],[],[],False,
Нижнетагильский технологический институт (филиал) Уральского федерального университета,Нижнетагильский технологический институт (филиал) УрФУ,Свердловская область,1,-1,https://tabiturient.ru/logovuz/ntiurfu.png,http://nti.urfu.ru/,['+7 (343) 525-65-00'],[],[],['59nti@urfu.ru'],False,
Новогородский государственный университет,НовГУ,Новгородская область,1,7,https://tabiturient.ru/logovuz/novsu.png,https://www.novsu.ru/,"['+7(8162)33-20-44', '8 (8162)33-20-44']",[],[],[],False,
Новгородский филиал Российской академии народного хозяйства и государственной службы при Президенте Российской Федерации,Новгородский филиал РАНХиГС,Новгородская область,1,-1,https://tabiturient.ru/logovuz/novgor_ranepa.png,https://novgor.ranepa.ru/,[],[],[],[],False,
Новомосковский институт (филиал) РХТУ им. Д.И. Менделеева,Новомосковский институт РХТУ им. Д.И. Менделеева,Тульская область,1,-1,https://tabiturient.ru/logovuz/nirhtu.png,https://www.nirhtu.ru/,[],[],[],[],False,
Новороссийский политехнический институт (филиал) Кубанского государственного технического университета,Новороссийский политехнический институт КубГТУ,Краснодарский край,1,-1,https://tabiturient.ru/logovuz/kubstu.png,http://npi.edu.ru/,[],[],[],[],False,
Новороссийский филиал Финансового Университета при Правительстве Российской Федерации,Новороссийский филиал ФУ при Правительстве РФ,Краснодарский край,1,-1,https://tabiturient.ru/logovuz/fu.png,http://www.fa.ru/fil/novoross/,[],[],[],[],False,
Новосибирский юридический институт (филиал) Томского государственного университета,Новосибирский юридический институт (филиал) ТГУ,Новосибирская область,1,-1,https://tabiturient.ru/logovuz/tgu.png,https://www.n-l-i.ru/,['8 (383) 217-74-30'],"['8 (383) 223-93-02', '8 (383) 217-74-30']",['pk@n-l-i.ru'],"['info@n-l-i.ru', 'pk@n-l-i.ru']",False,
Новотроицкий филиал Национального исследовательского технологического университета «МИСИС»,Новотроицкий филиал МИСиС,Оренбургская область,1,-1,https://tabiturient.ru/logovuz/misis.png,http://nf.misis.ru/,['+7 (3537) 67-96-17'],[],[],[],False,
Новочеркасский инженерно-мелиоративный институт им. А.К.Кортунова (филиал)  Донского государственного аграрного университета в г. Зернограде,Новочеркасский инженерно-мелиоративный институт им. А.К.Кортунова (филиал) ДГАУ,Ростовская область,1,-1,https://tabiturient.ru/logovuz/dongau.png,https://www.ngma.su/,[],[],['nimi-info@yandex.ru'],[],False,
Оренбургский государственный аграрный университет,ОГАУ,Оренбургская область,1,3,https://tabiturient.ru/logovuz/orensau.png,https://orensau.ru/,['8(3532) 77-52-30'],['8(3532) 77-52-30'],['rector@orensau.ru'],['rector@orensau.ru'],False,
Орловский государственный институт культуры,ОГИК,Орловская область,1,-1,https://tabiturient.ru/logovuz/ogiikorel.png,http://ogiik.orel.ru/,['+7(486)241-6191'],['+7 (486) 241-6191'],['main@ogik.ru'],['main@ogik.ru'],False,
Оренбургский государственный педагогический университет,ОГПУ,Оренбургская область,1,7,https://tabiturient.ru/logovuz/ospu.png,https://ospu.ru/,['8 (3532) 500393'],[],[],['ospu@ospu.ru'],False,
Оренбургский государственный университет,ОГУ,Оренбургская область,1,5,https://tabiturient.ru/logovuz/osu.png,http://www.osu.ru/,[],['8 800 222-55-71'],['post@mail.osu.ru'],[],True,
Орловский государственный университет имени И. С. Тургенева,ОГУ им. И.С. Тургенева,Орловская область,1,6,https://tabiturient.ru/logovuz/oreluniver.png,http://oreluniver.ru/,[],[],[],[],False,
Орловский государственный институт экономики и торговли,ОГУЭТ,Орловская область,1,3,https://tabiturient.ru/logovuz/orelgiet.png,https://orelgiet.ru/,[],[],[],[],False,
Озерский технологический институт (филиал) Национального исследовательского ядерного университета МИФИ,ОТИ НИЯУ МИФИ,Челябинская область,1,-1,https://tabiturient.ru/logovuz/otiru.png,https://oti.ru/,['+7 995 105-84-66'],[],['oti@mephi.ru'],['oti@mephi.ru'],False,
Омский государственный аграрный университет имени П.А.Столыпина,ОмГАУ им. П.А.Столыпина,Омская область,1,3,https://tabiturient.ru/logovuz/omgau.png,https://www.omgau.ru/,[],[],[],[],False,
Омский государственный медицинский университет,ОмГМУ,Омская область,1,9,https://tabiturient.ru/logovuz/osma.png,http://omsk-osma.ru/,[],[],[],"['abiturient@omgmu.ru', 'rector@omsk-osma.ru']",False,
Омский государственный педагогический университет,ОмГПУ,Омская область,1,5,https://tabiturient.ru/logovuz/omgpu.png,https://omgpu.ru/,[],[],[],[],False,
Омский государственный технический университет,ОмГТУ,Омская область,1,5,https://tabiturient.ru/logovuz/omgtu.png,https://www.omgtu.ru,['+7 (3812) 65-34-07'],[],[],['info@omgtu.ru'],True,
Омский государственный университет  им. Ф.М. Достоевского,ОмГУ им. Ф.М. Достоевского,Омская область,1,5,https://tabiturient.ru/logovuz/omsu.png,http://www.omsu.ru/,[],[],[],[],False,
Омский государственный университет путей сообщения,ОмГУПС,Омская область,1,3,https://tabiturient.ru/logovuz/omgups.png,http://www.omgups.ru/,['+7 (3812) 31-06-22'],['+7 (3812) 31-06-22'],['omgups@omgups.ru'],[],False,
Арктический государственный агротехнологический университет,АГАТУ,Республика Саха (Якутия),1,3,https://tabiturient.ru/logovuz/agatu.png,http://www.agatu.ru/,['+7 (967) 912-65-61'],[],['info@agatu.ru'],"['abiturient@agatu.ru', 'info@agatu.ru']",False,
Алтайский государственный гуманитарно-педагогический университет имени В.М. Шукшина,АГГПУ им. В.М. Шукшина,Алтайский край,1,5,https://tabiturient.ru/logovuz/bigpibiysk.png,http://www2.bigpi.biysk.ru/wwwsite/news.php,[],[],[],[],False,
Алтайский государственный институт культуры,АГИК,Алтайский край,1,-1,https://tabiturient.ru/logovuz/altgaki.png,http://www.altgaki.org/,[],[],[],[],False,
Арктический государственный институт культуры и искусств,АГИКИ,Республика Саха (Якутия),1,-1,https://tabiturient.ru/logovuz/agiki.png,http://agiki.ru/,"['+7(411)234-4460', '+7 (411) 234-4460']",['+7 (411) 234-4460'],['agiki@mail.ru'],['agiki@mail.ru'],False,
Алтайский государственный медицинский университет,АГМУ,Алтайский край,1,8,https://tabiturient.ru/logovuz/asmu.png,https://asmu.ru/,[],[],[],[],False,
Армавирский государственный педагогический университет,АГПУ,Краснодарский край,1,5,https://tabiturient.ru/logovuz/agpu.png,http://www.agpu.net/,[],[],[],[],False,
Астраханский государственный технический университет,АГТУ,Астраханская область,1,3,https://tabiturient.ru/logovuz/astu.png,http://astu.org/,[],[],[],[],False,
"Альметьевский государственный нефтяной институт ""Высшая школа нефти""",АГТУ ВШН,Республика Татарстан,1,6,https://tabiturient.ru/logovuz/agnirt.png,https://агту-вшн.рф,"[""8(8553)31-09-20"", ""8-917-280-02-38""]","[""p.agni@agni-rt.ru""]","['p.agni@agni-rt.ru', 'abiturient@agni-rt.ru', 'info@minobrnauki.gov.ru', 'agni@rambler.ru']","[""abiturient@agni-rt.ru""]",False,
Адыгейский государственный университет,АГУ,Республика Адыгея,1,5,https://tabiturient.ru/logovuz/adygnet.png,https://www.adygnet.ru/,[],"['8772) 57-02-73', '8\n(8772) 570273', '8772) 570273']",['adsu@adygnet.ru'],[],False,
Астраханский государственный университет,АГУ,Астраханская область,1,5,https://tabiturient.ru/logovuz/asu.png,http://asu.edu.ru/,[],[],[],[],False,
Алатырский филиал Чувашского государственного университета имени И.Н. Ульянова,Алатырский филиал ЧГУ им. И.Н. Ульянова,Чувашская Республика,1,-1,https://tabiturient.ru/logovuz/chuvsu.png,https://alatyr.chuvsu.ru/,[],[],[],[],False,
Алтайский государственный педагогический университет,АлтГПУ,Алтайский край,1,5,https://tabiturient.ru/logovuz/altspu.png,https://www.altspu.ru/,[],[],[],[],False,
Алтайский государственный технический университет имени И. И. Ползунова,АлтГТУ им. И.И. Ползунова,Алтайский край,1,5,https://tabiturient.ru/logovuz/altstu.png,https://www.altstu.ru/,[],[],[],[],False,
Алтайский государственный университет,АлтГУ,Алтайский край,1,7,https://tabiturient.ru/logovuz/altsu.png,https://www.asu.ru/,[],[],[],"['prcom@asu.ru', 'rector@asu.ru']",False,
Алтайский государственный аграрный университет,Алтайский ГАУ,Алтайский край,1,3,https://tabiturient.ru/logovuz/asau.png,http://www.asau.ru/ru/,['+7(3852)20-32-26'],[],[],"['628-396rector@asau.ru', 'primcom@asau.ru']",False,
Алтайский филиал Российской академии народного хозяйства и государственной службы при Президенте Российской Федерации,Алтайский филиал РАНХиГС,Алтайский край,1,-1,https://tabiturient.ru/logovuz/alt_ranepa.png,https://alt.ranepa.ru/,[],[],[],[],False,
Алтайский филиал Финансового Университета при Правительстве Российской Федерации,Алтайский филиал ФУ при Правительстве РФ,Алтайский край,1,-1,https://tabiturient.ru/logovuz/fu.png,http://www.fa.ru/fil/barnaul/,[],[],[],[],False,
Санкт-Петербургский национальный исследовательский Академический университет им. Ж. И. Алфёрова РАН,Алфёровский университет,Санкт-Петербург и Ленинградская область,1,8,https://tabiturient.ru/logovuz/spbau.png,https://spbau.ru/,[],[],['webmaster@spbau.ru'],[],False,
Альметьевский филиал Казанского национального исследовательского технического университета имени А. Н. Туполева,Альметьевский филиал КНИТУ-КАИ,Республика Татарстан,1,-1,https://tabiturient.ru/logovuz/kai.png,http://alf-kai.ru/,[],[],[],['alf@alf-kai.ru'],False,
Амурская государственная медицинская академия,АмГМА,Амурская область,1,7,https://tabiturient.ru/logovuz/amursma.png,https://www.amursma.ru/,[],[],['AmurSMA@AmurSMA.su'],['priemnaya@amurgma.ru'],False,
Амурский гуманитарно-педагогический государственный университет,АмГПГУ,Хабаровский край,1,5,https://tabiturient.ru/logovuz/amgpgu.png,https://www.amgpgu.ru/,['+7(4217)59-14-30'],[],[],['pr@amgpgu.ru'],False,
Ангарский государственный технический университет,АнГТУ,Иркутская область,1,3,https://tabiturient.ru/logovuz/angtu.png,http://angtu.ru/,['8 (3955) 67-18-32'],[],[],[],False,
Анапский филиал Московского педагогического государственного университета,Анапский филиал МПГУ,Краснодарский край,1,-1,https://tabiturient.ru/logovuz/mpguanapskiyfilial.png,http://mpgu.su/ob-mpgu/struktura/filialyi/anapskiy-filial,['8(961)8522595'],[],[],['f.anapa@mpgu.su'],False,
Арзамасский политехнический институт (филиал) Нижегородского государственного технического университета имени Р.Е. Алексеева,Арзамасский политехнический институт НГТУ им. Р.Е. Алексеева,Нижегородская область,1,-1,https://tabiturient.ru/logovuz/nntu.png,https://api.nntu.ru/,[],[],['cou@apinntu.ru'],['cou@apinntu.ru'],False,
Арзамасский филиал Нижегородского государственного университета имени Н. И. Лобачевского,Арзамасский филиал ННГУ,Нижегородская область,1,-1,https://tabiturient.ru/logovuz/unn.png,https://arz.unn.ru/,[],[],[],[],False,
Армавирский механико-технологический институт (филиал) Кубанского государственного технического университета,Армавирский механико-технологический институт КубГТУ,Краснодарский край,1,-1,https://tabiturient.ru/logovuz/kubstu.png,http://www.amti.ru/,[],[],[],[],False,
Астраханский государственный медицинский университет,Астраханский ГМУ,Астраханская область,1,8,https://tabiturient.ru/logovuz/astrahangmu.png,http://astgmu.ru/,[],['+7(8512) 66-94-78'],['post@astgmu.ru'],[],False,
