long_name,short_name,geolocation,is_goverment,rating,logo,website,phone_admission,phone_general,email_general,email_admission,army,comment
Ивановский государственный химико-технологический университет,ИГХТУ,Ивановская область,1,3,https://tabiturient.ru/logovuz/isuct.png,https://www.isuct.ru/,['+7 (4932) 329241'],['+7 (4932) 329241'],[],[],False,
Ивановский государственный энергетический университет имени В.И. Ленина,ИГЭУ,Ивановская область,1,6,https://tabiturient.ru/logovuz/ispu.png,http://ispu.ru/,[],[],['385-696office@ispu.ru'],"['269-749pk@ispu.ruhttp', '385-696office@ispu.ru']",True,
Иркутский национальный исследовательский технический университет,ИРНИТУ,Иркутская область,1,5,https://tabiturient.ru/logovuz/istu.png,https://www.istu.edu/,['8\xa0800\xa01005405'],['8\xa0800\xa01005405'],"['cpk@istu.edu', 'info@istu.edu']","['info@istu.edu', 'cpk@istu.edu']",True,
"Санкт-Петербургский национальный исследовательский университет информационных технологий, механики и оптики",ИТМО,Санкт-Петербург и Ленинградская область,1,10,https://tabiturient.ru/logovuz/itmo.png,http://www.ifmo.ru,['+7 (812) 480-00-00'],[],[],['232-23-07od@itmo.ru'],False,
Ивангородский гуманитарно-технический институт (филиал) Санкт-Петербургского государственного университета аэрокосмического приборостроения,ИФ ГУАП,Санкт-Петербург и Ленинградская область,1,-1,https://tabiturient.ru/logovuz/spbguap.png,https://ifguap.ru/main,[],[],[],[],False,
Ивановская государственная медицинская академия,ИвГМА,Ивановская область,1,7,https://tabiturient.ru/logovuz/isma.png,https://www.isma.ivanovo.ru/,[],[],[],[],False,
Ивановский государственный университет,ИвГУ,Ивановская область,1,6,https://tabiturient.ru/logovuz/ivanovoac.png,http://www.ivanovo.ac.ru/,[],[],[],[],False,
Ивановский филиал Российской академии народного хозяйства и государственной службы при Президенте Российской Федерации,Ивановский филиал РАНХиГС,Ивановская область,1,-1,https://tabiturient.ru/logovuz/iv_ranepa.png,https://iv.ranepa.ru/,[],[],[],[],True,
Ивановский филиал Российского экономического университета имени Г.В. Плеханова,Ивановский филиал РЭУ им. Плеханова,Ивановская область,1,-1,https://tabiturient.ru/logovuz/reu.png,https://ivanovo.rea.ru/,['+7 (495) 958-27-43'],['8 (800) 222-55-71'],[],['rector@rea.ru'],False,
Ижевский государственный технический университет имени М. Т. Калашникова,ИжГТУ им. М.Т. Калашникова,Удмуртская Республика,1,5,https://tabiturient.ru/logovuz/izstu.png,https://istu.ru/,[],[],['info@istu.ru'],[],False,
Ижевский институт (филиал) Всероссийского государственного университета юстиции (РПА Минюста России),Ижевский институт ВГУЮ,Удмуртская Республика,1,-1,https://tabiturient.ru/logovuz/rpa.png,https://izh.rpa-mu.ru/,[],['8 (3412) 94-03-00'],['priem.rpa@mail.ru'],[],False,
Ингушский государственный университет,ИнгГУ,Республика Ингушетия,1,5,https://tabiturient.ru/logovuz/inggu.png,http://inggu.ru/,[],[],[],[],False,
Инженерно-технологическая академия - филиал Южного федерального университета в г. Таганроге,Инженерно-технологическая академия ЮФУ,Ростовская область,1,-1,https://tabiturient.ru/logovuz/sfedu.png,https://sfedu.ru/www/stat_pages22.show?p=ELS/inf/D&x=ELS/9500000000000,['+7 863) 218-40-00'],[],[],[],False,
Инзенский филиал Ульяновского государственного университета,Инзенский филиал УлГУ,Ульяновская область,1,-1,https://tabiturient.ru/logovuz/ulsu.png,https://ulsu.ru/ru/sveden/struct/13829061-f201-11de-8bdd-001a92e75bb4/,"['8 (8422) 41-20-88', '8 (8422) 41-20-90']",['8 (8422) 41-20-88'],['contact@ulsu.ru'],['contact@ulsu.ru'],False,
Институт агроэкологии (филиал) Южно-Уральского государственного аграрного университета,Институт агроэкологии ЮУрГАУ,Челябинская область,1,-1,https://tabiturient.ru/logovuz/yuurgau.png,http://insagro.sursau.ru/,['+7 (351) 266-65-30'],['+7 (351) 266-65-30'],['pochta@insagro.ru'],['pochta@insagro.ru'],False,
Институт водного транспорта имени Г.Я. Седова (филиал) Государственного морского университета имени адмирала Ф.Ф. Ушакова  в г. Ростов-на-Дону,Институт водного транспорта имени Г.Я. Седова ГМУ им. адм. Ф.Ф. Ушакова в г. Ростов-на-Дону,Ростовская область,1,-1,https://tabiturient.ru/logovuz/aumsu.png,https://iwtsedov.ru/,[],['+7 (863) 333-28-34'],['official@iwtsedov.ru'],[],False,
Институт морского и речного флота имени Героя Советского Союза М.П. Девятаева - Казанский филиал Волжского государственного университета водного транспорта,Институт морского и речного флота имени Героя Советского Союза М.П. Девятаева ВГУВТ,Республика Татарстан,1,-1,https://tabiturient.ru/logovuz/vsuwt.png,http://www.vguvtkazan.ru/,[],['8 (843) 528-50-19'],['vguvtkazan@yandex.ru'],[],False,
Брянский государственный аграрный университет,БГАУ,Брянская область,1,3,https://tabiturient.ru/logovuz/bryanskgsha.png,https://www.bgsha.com,[],[],[],[],False,
Владивостокский государственный университет,ВВГУ,Приморский край,1,6,https://tabiturient.ru/logovuz/vvsu.png,https://www.vvsu.ru/,[],['+7 (423) 240-40-23'],['abiturient@vvsu.ru'],[],True,
Волгоградский государственный университет,ВолГУ,Волгоградская область,1,6,https://tabiturient.ru/logovuz/volsu.png,https://volsu.ru/,"['8 (8442) 46-02-79', '8 (8442) 40-55-47']",[],[],[],False,
Волгоградский государственный медицинский университет,ВолгГМУ,Волгоградская область,1,9,https://tabiturient.ru/logovuz/volgmed.png,https://www.volgmed.ru/ru/,[],[],[],[],False,
Дербентский филиал Московского педагогического государственного университета,Дербентский филиал МПГУ,Республика Дагестан,1,-1,https://tabiturient.ru/logovuz/mpguderbentskiyfilial.png,http://mpgu.su/ob-mpgu/struktura/filialyi/derbentskiy-filial,[],[],['f_derbent@mpgu.su'],['f_derbent@mpgu.su'],False,
Омский филиал Российской академии народного хозяйства и государственной службы при Президенте Российской Федерации,Омский филиал РАНХиГС,Омская область,1,-1,https://tabiturient.ru/logovuz/omsk_ranepa.png,https://omsk.ranepa.ru/,[],[],[],[],False,
Омский филиал Финансового Университета при Правительстве Российской Федерации,Омский филиал ФУ при Правительстве РФ,Омская область,1,-1,https://tabiturient.ru/logovuz/fu.png,http://www.fa.ru/fil/omsk/,[],[],[],[],False,
Оренбургский государственный медицинский университет,ОрГМУ,Оренбургская область,1,7,https://tabiturient.ru/logovuz/orgma.png,https://www.orgma.ru/,[],['8 (800) 200-05-52'],[],[],False,
Оренбургский филиал Российской академии народного хозяйства и государственной службы при Президенте Российской Федерации,Оренбургский филиал РАНХиГС,Оренбургская область,1,-1,https://tabiturient.ru/logovuz/orn_ranepa.png,https://orn.ranepa.ru/,[],[],[],[],False,
Оренбургский филиал Российского экономического университета имени Г.В. Плеханова,Оренбургский филиал РЭУ им. Плеханова,Оренбургская область,1,-1,https://tabiturient.ru/logovuz/reu.png,https://orenburg.rea.ru/,['+7 (495) 958-27-43'],['8 (800) 222-55-71'],[],['rector@rea.ru'],False,
Оренбургский институт - филиал Университета имени О. Е. Кутафина (МГЮА),Оренбургский филиал Университета им. Кутафина (МГЮА),Оренбургская область,1,-1,https://tabiturient.ru/logovuz/mgua.png,http://www.oimsla.edu.ru/,[],[],[],[],False,
Орловский государственный аграрный университет имени Н.В. Парахина,Орловский ГАУ,Орловская область,1,3,https://tabiturient.ru/logovuz/orelsau.png,https://www.orelsau.ru/,"['+7 (4862) 76-15-17', '+7 (4862) 43-69-98']",[],[],['office1@orelsau.ru'],False,
Орловский филиал Финансового Университета при Правительстве Российской Федерации,Орловский филиал ФУ при Правительстве РФ,Орловская область,1,-1,https://tabiturient.ru/logovuz/fu.png,http://www.fa.ru/fil/orel/,[],[],[],[],False,
Орский гуманитарно-технологический институт (филиал) Оренбургского государственного университета,Орский гуманитарно-технологический институт (филиал) ОГУ,Оренбургская область,1,-1,https://tabiturient.ru/logovuz/osu.png,http://ogti.osu.ru/,[],[],['direktor@ogti.orsk.ru'],[],False,
Поволжский государственный университет сервиса,ПВГУС,Самарская область,1,5,https://tabiturient.ru/logovuz/tolgas.png,https://www.tolgas.ru/,[],['+7 (8482) 22-22-83'],['22-22-83priem@tolgas.ru'],[],False,
Пермский государственный аграрно-технологический университет имени академика Д. Н. Прянишникова,ПГАТУ,Пермский край,1,3,https://tabiturient.ru/logovuz/pgsha.png,https://pgsha.ru/,[],['8 (342) 217-98-17'],['info@pgatu.ru'],[],False,
Пермский государственный гуманитарно-педагогический университет,ПГГПУ,Пермский край,1,7,https://tabiturient.ru/logovuz/pspu.png,https://tabiturient.ru/sravni/?pspu,[],[],[],[],False,
Петрозаводская государственная консерватория имени А. К. Глазунова,ПГК им. А.К. Глазунова,Республика Карелия,1,-1,https://tabiturient.ru/logovuz/glazunovcons.png,http://glazunovcons.ru/,[],['+7 8142 67-23-67'],['info@glazunovcons.ru'],[],False,
Пермский государственный медицинский университет им. академика Е. А. Вагнера,ПГМУ им. академика Е.А. Вагнера,Пермский край,1,6,https://tabiturient.ru/logovuz/psma.png,https://psma.ru/,['+7 (342) 217-21-20'],['+7 (342) 217-21-20'],"['koroleva.ef@psma.ru', 'psmu@psma.ru']",['koroleva.ef@psma.ru'],False,
Пермский государственный национальный исследовательский университет,ПГНИУ,Пермский край,1,7,https://tabiturient.ru/logovuz/psu.png,http://www.psu.ru/,[],[],[],['info@psu.ru'],False,
Поволжский государственный технологический университет,ПГТУ (Волгатех),Республика Марий Эл,1,5,https://tabiturient.ru/logovuz/volgatech.net.png,https://www.volgatech.net/,"['+7 (8362) 68-68-70', '8362) 68-78-08', '+7 (8362) 68-78-08']",[],[],"['info@volgatech.net', 'priem@volgatech.net']",True,
Пятигорский государственный университет,ПГУ,Ставропольский край,1,7,https://tabiturient.ru/logovuz/pgu.png,http://pgu.ru/,[],[],[],['damhurc@pgu.ru'],False,
Пензенский государственный университет,ПГУ,Пензенская область,1,6,https://tabiturient.ru/logovuz/pnzgu.png,https://pnzgu.ru/,['+7 (8412) 66-64-19'],[],[],['cnit@pnzgu.ru'],True,
Приамурский государственный университет имени Шолом-Алейхема,ПГУ им. Шолом-Алейхема,Еврейская автономная область,1,6,https://tabiturient.ru/logovuz/pgusa.png,http://pgusa.ru/,['+7 (900) 418-26-86'],[],[],"['abiturient@pgusa.ru', 'rectorat@pgusa.ru']",False,
Петербургский государственный университет путей сообщения Императора Александра I,ПГУПС,Санкт-Петербург и Ленинградская область,1,5,https://tabiturient.ru/logovuz/pgups.png,https://www.pgups.ru/,[],[],[],['dou@pgups.ru'],False,
Поволжский государственный университет телекоммуникаций и информатики,ПГУТИ,Самарская область,1,5,https://tabiturient.ru/logovuz/psuti.png,https://www.psuti.ru/,[],[],[],[],False,
Пермская государственная фармацевтическая академия,ПГФА,Пермский край,1,3,https://tabiturient.ru/logovuz/pfa.png,http://pfa.ru/,[],[],['perm@pfa.ru'],[],False,
Пермский институт железнодорожного транспорта (филиал) Уральского государственного университета путей сообщения,ПИЖТ УрГУПС,Пермский край,1,-1,https://tabiturient.ru/logovuz/usurt.png,https://pirt.usurt.ru/,[],"['+7 (343) 221-24-40', '+7 (342) 201-43-50']",[],[],False,
Приволжский исследовательский медицинский университет,ПИМУ,Нижегородская область,1,9,https://tabiturient.ru/logovuz/pimunn.png,https://pimunn.ru/,"['+7 831 422-12-50', '+7 831 422-20-00']","['+7 831 422-20-00', '+7 831 439-01-84']",['rector@pimunn.net'],['rector@pimunn.net'],False,
Пятигорский медико-фармацевтический институт (филиал) Волгоградского государственного медицинского университета,ПМФИ (филиал) ВолгГМУ,Ставропольский край,1,-1,https://tabiturient.ru/logovuz/volgmed.png,https://www.pmedpharm.ru/,[],[],[],['ovz@pmedpharm.ru'],False,
Пермский национальный исследовательский политехнический университет,ПНИПУ,Пермский край,1,6,https://tabiturient.ru/logovuz/pstu.png,http://pstu.ru/,[],[],['kanc@pstu.ru'],['enter@pstu.ru'],False,
Первый Санкт-Петербургский государственный медицинский университет им. акад. И. П. Павлова,ПСПбГМУ им. И. П. Павлова,Санкт-Петербург и Ленинградская область,1,10,https://tabiturient.ru/logovuz/spbgmu.png,http://1spbgmu.ru/,['+7 (495) 198-00-00'],[],[],[],False,
Приволжский филиал Российского Государственного Университета Правосудия (г. Нижний Новгород),ПФ ФГБОУВО «РГУП»,Нижегородская область,1,-1,https://tabiturient.ru/logovuz/raj.png,https://vrb.rgup.ru/,['+7 (831) 433-11-75'],[],[],['rap_pf_nnov@mail.ru'],False,
Павловский филиал Нижегородского государственного университета имени Н. И. Лобачевского,Павловский филиал ННГУ,Нижегородская область,1,-1,https://tabiturient.ru/logovuz/unn.png,http://www.unn.ru/cdo/Pavlovo,[],[],[],[],False,
Пензенский государственный технологический университет,ПензГТУ,Пензенская область,1,6,https://tabiturient.ru/logovuz/penzgtu.png,http://www.penzgtu.ru/,[],[],['rector@penzgtu.ru'],[],False,
Пензенский государственный аграрный университет,Пензенский ГАУ,Пензенская область,1,3,https://tabiturient.ru/logovuz/pgau.png,https://pgau.ru/,[],[],[],[],False,
Пензенский казачий государственный институт технологий (филиал) Московского государственного университета технологий и управления им. К.Г. Разумовского,Пензенский казачий институт технологий МГУТУ,Пензенская область,1,-1,https://tabiturient.ru/logovuz/mgutu.png,https://mgutupenza.ru/,['8412) 46-99-88'],"['8(8412) 46-99-60', '8412) 46-99-88']",[],['pk.penza@mgutm.ru'],False,
Пензенский филиал Финансового Университета при Правительстве Российской Федерации,Пензенский филиал ФУ при Правительстве РФ,Пензенская область,1,-1,https://tabiturient.ru/logovuz/fu.png,http://www.fa.ru/fil/penza/,[],[],[],[],False,
Пермский институт - филиал Российского экономического университета имени Г.В. Плеханова,Пермский институт РЭУ им. Плеханова,Пермский край,1,-1,https://tabiturient.ru/logovuz/reu.png,https://perm.rea.ru/,"['+7 (495) 958-27-43', '+7 (342) 263-26-75']","['+7 (342) 263-26-75', '8 (800) 222-55-71']","['perm@rea.ru', 'perm.pk@rea.ru']","['rector@rea.ru', 'perm.pk@rea.ru']",False,
Пермский филиал Волжского государственного университета водного транспорта,Пермский филиал ВГУВТ,Пермский край,1,-1,https://tabiturient.ru/logovuz/vsuwt.png,https://vsuwt-perm.ru/,['+7(342) 215-85-52'],[],[],['priem@vsuwt-perm.ru'],False,
Пермский филиал Российской академии народного хозяйства и государственной службы при Президенте Российской Федерации,Пермский филиал РАНХиГС,Пермский край,1,-1,https://tabiturient.ru/logovuz/perm_ranepa.png,https://perm.ranepa.ru/,[],[],[],[],False,
Петрозаводский государственный университет,ПетрГУ,Республика Карелия,1,5,https://tabiturient.ru/logovuz/petrsu.png,https://petrsu.ru/,[],[],"['priem@petrsu.ru', 'office@petrsu.ruT']",[],True,
Петропавловский филиал Российской академии народного хозяйства и государственной службы при Президенте Российской Федерации,Петропавловский филиал РАНХиГС,Камчатский край,1,-1,https://tabiturient.ru/logovuz/pk_ranepa.png,https://pk.ranepa.ru/,[],[],[],[],False,
"Поволжский государственный университет физической культуры, спорта и туризма",Поволжский ГУФКСиТ,Республика Татарстан,1,5,https://tabiturient.ru/logovuz/sportacadem.png,https://www.sportacadem.ru/,[],['8 (843) 294-90-02'],[],[],False,
Поволжский институт (филиал) Всероссийского государственного университета юстиции (РПА Минюста России),Поволжский институт ВГУЮ,Саратовская область,1,-1,https://tabiturient.ru/logovuz/rpa.png,https://saratov2.rpa-mu.ru/,[],[],[],[],False,
Поволожский институт управления - филиал Российской академии народного хозяйства и государственной службы при Президенте Российской Федерации,Поволжский институт управления РАНХиГС,Саратовская область,1,-1,https://tabiturient.ru/logovuz/piu_ranepa.png,https://piu.ranepa.ru/,[],[],[],[],False,
Поволжский казачий государственный институт управления и пищевых технологий - филиал Московского государственного университета технологий и управления им. К.Г. Разумовского,Поволжский казачий институт управления и пищевых технологий МГУТУ,Ульяновская область,1,-1,https://tabiturient.ru/logovuz/mgutu.png,http://www.dimpku.ru/,[],[],[],[],False,
Покровский филиал Московского педагогического государственного университета,Покровский филиал МПГУ,Владимирская область,1,-1,https://tabiturient.ru/logovuz/mpgupokrovskiyfilial.png,http://mpgu.su/ob-mpgu/struktura/filialyi/pokrovskiy-filial,[],[],[],['f_pokrov@mpgu.su'],False,
Политехнический институт (филиал) Уральского федерального университета в Каменске-Уральском,Политехнический институт (филиал) УрФУ в Каменске-Уральском,Свердловская область,1,-1,https://tabiturient.ru/logovuz/kuralskurfu.png,https://k-uralsk.urfu.ru/ru/,[],['+7(3439) 32-22-92'],['k-uralsk@urfu.ru'],[],False,
Политехнический институт (филиал) Донского государственного технического университета в г. Таганроге,Политехнический институт ДГТУ в г. Таганроге,Ростовская область,1,-1,https://tabiturient.ru/logovuz/donstu.png,https://tpi.donstu.ru/,[],[],[],[],False,
Политехнический институт (филиал) Северо-Восточного федерального университета имени М.К. Аммосова,Политехнический институт СВФУ им. М.К. Аммосова в г. Мирном,Республика Саха (Якутия),1,-1,https://tabiturient.ru/logovuz/svfu.png,https://www.s-vfu.ru/abit/detail.php?SECTION_ID=5471,[],[],[],[],False,
Приморский государственный аграрно-технологический университет,Приморский ГАТУ,Приморский край,1,3,https://tabiturient.ru/logovuz/primacad.png,http://www.primacad.ru/,[],['8 (4234) 26-54-34'],['prikom@primacad.ru'],[],False,
Приморский филиал Российской академии народного хозяйства и государственной службы при Президенте Российской Федерации,Приморский филиал РАНХиГС,Приморский край,1,-1,https://tabiturient.ru/logovuz/prim_ranepa.png,https://prim.ranepa.ru/,[],['+7 (423) 263-01-85'],['post-prim@ranepa.ru'],[],False,
Псковский государственный университет,ПсковГУ,Псковская область,1,6,https://tabiturient.ru/logovuz/pskgu.png,https://pskgu.ru/,[],[],[],"['rector@pskgu.ru', 'priem@pskgu.ru']",True,
Пятигорский институт (филиал) Северо-Кавказского федерального университета,Пятигорский институт (филиал) СКФУ,Ставропольский край,1,-1,https://tabiturient.ru/logovuz/ncfu.png,https://pf.ncfu.ru/,"['+7 8793 97-39-27', '+7 8793 33-77-61']","['+7 8793 33-77-61', '+7 8793 97-39-27']",[],[],True,
